http://rs.tdwg.org/dwc/terms/,http://rs.tdwg.org/dwc/terms/verbatimCoordinates,Verbatim Coordinates,"The verbatim original spatial coordinates of the Location. The coordinate ellipsoid, geodeticDatum, or full Spatial Reference System (SRS) for these coordinates should be stored in verbatimSRS and the coordinate system should be stored in verbatimCoordinateSystem. see also http://rs.tdwg.org/dwc/terms/index.htm#verbatimCoordinates. Examples: ""41 05 54S 121 05 34W"", ""17T 630000 4833400"""
http://rs.tdwg.org/dwc/terms/,http://rs.tdwg.org/dwc/terms/verbatimLatitude,Verbatim Latitude,"The verbatim original latitude of the Location. The coordinate ellipsoid, geodeticDatum, or full Spatial Reference System (SRS) for these coordinates should be stored in verbatimSRS and the coordinate system should be stored in verbatimCoordinateSystem. see also http://rs.tdwg.org/dwc/terms/index.htm#verbatimLatitude. Examples: ""41 05 54.03S"""
http://rs.tdwg.org/dwc/terms/,http://rs.tdwg.org/dwc/terms/verbatimLongitude,Verbatim Longitude,"The verbatim original longitude of the Location. The coordinate ellipsoid, geodeticDatum, or full Spatial Reference System (SRS) for these coordinates should be stored in verbatimSRS and the coordinate system should be stored in verbatimCoordinateSystem. see also http://rs.tdwg.org/dwc/terms/index.htm#verbatimLongitude. Examples: ""121d 10' 34"" W"""
http://rs.tdwg.org/dwc/terms/,http://rs.tdwg.org/dwc/terms/verbatimCoordinateSystem,Verbatim Coordinate System,"The spatial coordinate system for the verbatimLatitude and verbatimLongitude or the verbatimCoordinates of the Location. Recommended best practice is to use a controlled vocabulary. see also http://rs.tdwg.org/dwc/terms/index.htm#verbatimCoordinateSystem. Examples: ""decimal degrees"", ""degrees decimal minutes"", ""degrees minutes seconds"", ""UTM"""
http://rs.tdwg.org/dwc/terms/,http://rs.tdwg.org/dwc/terms/verbatimSRS,Verbatim SRS,"The ellipsoid, geodetic datum, or spatial reference system (SRS) upon which coordinates given in verbatimLatitude and verbatimLongitude, or verbatimCoordinates are based. Recommended best practice is use the EPSG code as a controlled vocabulary to provide an SRS, if known. Otherwise use a controlled vocabulary for the name or code of the geodetic datum, if known. Otherwise use a controlled vocabulary for the name or code of the ellipsoid, if known. If none of these is known, use the value ""unknown"". see also http://rs.tdwg.org/dwc/terms/index.htm#verbatimSRS. Examples: ""EPSG:4326"", ""WGS84"", ""NAD27"", ""Campo Inchauspe"", ""European 1950"", ""Clarke 1866"""
http://rs.tdwg.org/dwc/terms/,http://rs.tdwg.org/dwc/terms/decimalLatitude,Decimal Latitude,"The geographic latitude (in decimal degrees, using the spatial reference system given in geodeticDatum) of the geographic center of a Location. Positive values are north of the Equator, negative values are south of it. Legal values lie between -90 and 90, inclusive. see also http://rs.tdwg.org/dwc/terms/index.htm#decimalLatitude. Examples: ""-41.0983423"""
http://rs.tdwg.org/dwc/terms/,http://rs.tdwg.org/dwc/terms/decimalLongitude,Decimal Longitude,"The geographic longitude (in decimal degrees, using the spatial reference system given in geodeticDatum) of the geographic center of a Location. Positive values are east of the Greenwich Meridian, negative values are west of it. Legal values lie between -180 and 180, inclusive. see also http://rs.tdwg.org/dwc/terms/index.htm#decimalLongitude. Examples: ""-121.1761111"""
http://rs.tdwg.org/dwc/terms/,http://rs.tdwg.org/dwc/terms/geodeticDatum,Geodetic Datum,"The ellipsoid, geodetic datum, or spatial reference system (SRS) upon which the geographic coordinates given in decimalLatitude and decimalLongitude as based. Recommended best practice is use the EPSG code as a controlled vocabulary to provide an SRS, if known. Otherwise use a controlled vocabulary for the name or code of the geodetic datum, if known. Otherwise use a controlled vocabulary for the name or code of the ellipsoid, if known. If none of these is known, use the value ""unknown"". see also http://rs.tdwg.org/dwc/terms/index.htm#geodeticDatum. Examples: ""EPSG:4326"", ""WGS84"", ""NAD27"", ""Campo Inchauspe"", ""European 1950"", ""Clarke 1866"""
http://rs.tdwg.org/dwc/terms/,http://rs.tdwg.org/dwc/terms/coordinateUncertaintyInMeters,Coordinate Uncertainty In Meters,"The horizontal distance (in meters) from the given decimalLatitude and decimalLongitude describing the smallest circle containing the whole of the Location. Leave the value empty if the uncertainty is unknown, cannot be estimated, or is not applicable (because there are no coordinates). Zero is not a valid value for this term. see also http://rs.tdwg.org/dwc/terms/index.htm#coordinateUncertaintyInMeters. Examples: ""30"" (reasonable lower limit of a GPS reading under good conditions if the actual precision was not recorded at the time), ""71"" (uncertainty for a UTM coordinate having 100 meter precision and a known spatial reference system)."
http://rs.tdwg.org/dwc/terms/,http://rs.tdwg.org/dwc/terms/coordinatePrecision,Coordinate Precision,"A decimal representation of the precision of the coordinates given in the decimalLatitude and decimalLongitude. see also http://rs.tdwg.org/dwc/terms/index.htm#coordinatePrecision. Examples: ""0.00001"" (normal GPS limit for decimal degrees), ""0.000278"" (nearest second), ""0.01667"" (nearest minute), ""1.0"" (nearest degree)"
http://rs.tdwg.org/dwc/terms/,http://rs.tdwg.org/dwc/terms/pointRadiusSpatialFit,Point Radius Spatial Fit,"The ratio of the area of the point-radius (decimalLatitude, decimalLongitude, coordinateUncertaintyInMeters) to the area of the true (original, or most specific) spatial representation of the Location. Legal values are 0, greater than or equal to 1, or undefined. A value of 1 is an exact match or 100% overlap. A value of 0 should be used if the given point-radius does not completely contain the original representation. The pointRadiusSpatialFit is undefined (and should be left blank) if the original representation is a point without uncertainty and the given georeference is not that same point (without uncertainty). If both the original and the given georeference are the same point, the pointRadiusSpatialFit is 1. see also http://rs.tdwg.org/dwc/terms/index.htm#pointRadiusSpatialFit. Examples: Detailed explanations with graphical examples can be found in the ""Guide to Best Practices for Georeferencing"", Chapman and Wieczorek, eds. 2006 (http://www.gbif.org/prog/digit/Georeferencing)."
http://rs.tdwg.org/dwc/terms/,http://rs.tdwg.org/dwc/terms/footprintWKT,Footprint WKT,"A Well-Known Text (WKT) representation of the shape (footprint, geometry) that defines the Location. A Location may have both a point-radius representation (see decimalLatitude) and a footprint representation, and they may differ from each other. see also http://rs.tdwg.org/dwc/terms/index.htm#footprintWKT. Examples: the one-degree bounding box with opposite corners at (longitude=10, latitude=20) and (longitude=11, latitude=21) would be expressed in well-known text as POLYGON ((10 20, 11 20, 11 21, 10 21, 10 20))"
http://rs.tdwg.org/dwc/terms/,http://rs.tdwg.org/dwc/terms/footprintSRS,Footprint SRS,"A Well-Known Text (WKT) representation of the Spatial Reference System (SRS) for the footprintWKT of the Location. Do not use this term to describe the SRS of the decimalLatitude and decimalLongitude, even if it is the same as for the footprintWKT - use the geodeticDatum instead. see also http://rs.tdwg.org/dwc/terms/index.htm#footprintSRS. Examples: The WKT for the standard WGS84 SRS (EPSG:4326) is ""GEOGCS[""GCS_WGS_1984"",DATUM[""D_WGS_1984"",SPHEROID[""WGS_1984"",6378137,298.257223563]],PRIMEM[""Greenwich"",0],UNIT[""Degree"",0.0174532925199433]]"" without the enclosing quotes."
http://rs.tdwg.org/dwc/terms/,http://rs.tdwg.org/dwc/terms/footprintSpatialFit,Footprint Spatial Fit,"The ratio of the area of the footprint (footprintWKT) to the area of the true (original, or most specific) spatial representation of the Location. Legal values are 0, greater than or equal to 1, or undefined. A value of 1 is an exact match or 100% overlap. A value of 0 should be used if the given footprint does not completely contain the original representation. The footprintSpatialFit is undefined (and should be left blank) if the original representation is a point and the given georeference is not that same point. If both the original and the given georeference are the same point, the footprintSpatialFit is 1. see also http://rs.tdwg.org/dwc/terms/index.htm#footprintSpatialFit. Examples: Detailed explanations with graphical examples can be found in the ""Guide to Best Practices for Georeferencing"", Chapman and Wieczorek, eds. 2006 (http://www.gbif.org/prog/digit/Georeferencing)."
http://rs.tdwg.org/dwc/terms/,http://rs.tdwg.org/dwc/terms/georeferencedBy,Georeferenced By,"A list (concatenated and separated) of names of people, groups, or organizations who determined the georeference (spatial representation) the Location. see also http://rs.tdwg.org/dwc/terms/index.htm#georeferencedBy. Examples: ""Kristina Yamamoto (MVZ); Janet Fang (MVZ)"", ""Brad Millen (ROM)"""
http://rs.tdwg.org/dwc/terms/,http://rs.tdwg.org/dwc/terms/georeferencedDate,Georeferenced Date,"The date on which the Location was georeferenced. Recommended best practice is to use an encoding scheme, such as ISO 8601:2004(E). see also http://rs.tdwg.org/dwc/terms/index.htm#georeferencedDate. Examples: 1963-03-08"
http://rs.tdwg.org/dwc/terms/,http://rs.tdwg.org/dwc/terms/georeferenceProtocol,Georeference Protocol,"A description or reference to the methods used to determine the spatial footprint, coordinates, and uncertainties. see also http://rs.tdwg.org/dwc/terms/index.htm#georeferenceProtocol. Examples: ""Guide to Best Practices for Georeferencing"" (Chapman and Wieczorek, eds. 2006), Global Biodiversity Information Facility."", ""MaNIS/HerpNet/ORNIS Georeferencing Guidelines"", ""BioGeomancer"""
http://rs.tdwg.org/dwc/terms/,http://rs.tdwg.org/dwc/terms/georeferenceSources,Georeference Sources,"A list (concatenated and separated) of maps, gazetteers, or other resources used to georeference the Location, described specifically enough to allow anyone in the future to use the same resources. see also http://rs.tdwg.org/dwc/terms/index.htm#georeferenceSources. Examples: ""USGS 1:24000 Florence Montana Quad; Terrametrics 2008 on Google Earth"""
http://rs.tdwg.org/dwc/terms/,http://rs.tdwg.org/dwc/terms/georeferenceVerificationStatus,Georeference Verification Status,"A categorical description of the extent to which the georeference has been verified to represent the best possible spatial description. Recommended best practice is to use a controlled vocabulary. see also http://rs.tdwg.org/dwc/terms/index.htm#georeferenceVerificationStatus. Examples: ""requires verification"", ""verified by collector"", ""verified by curator""."
http://rs.tdwg.org/dwc/terms/,http://rs.tdwg.org/dwc/terms/georeferenceRemarks,Georeference Remarks,"Notes or comments about the spatial description determination, explaining assumptions made in addition or opposition to the those formalized in the method referred to in georeferenceProtocol. see also http://rs.tdwg.org/dwc/terms/index.htm#georeferenceRemarks. Examples: ""assumed distance by road (Hwy. 101)"""
http://rs.tdwg.org/dwc/terms/,http://rs.tdwg.org/dwc/terms/occurrenceID,Occurrence ID,"An identifier for the Occurrence (as opposed to a particular digital record of the occurrence). In the absence of a persistent global unique identifier, construct one from a combination of identifiers in the record that will most closely make the occurrenceID globally unique. see also http://rs.tdwg.org/dwc/terms/index.htm#occurrenceID. Examples: For a specimen in the absence of a bona fide global unique identifier, for example, use the form: ""urn:catalog:[institutionCode]:[collectionCode]:[catalogNumber]. ""urn:lsid:nhm.ku.edu:Herps:32"", ""urn:catalog:FMNH:Mammal:145732"""
http://rs.tdwg.org/dwc/terms/,http://rs.tdwg.org/dwc/terms/catalogNumber,Catalog Number,"An identifier (preferably unique) for the record within the data set or collection. see also http://rs.tdwg.org/dwc/terms/index.htm#catalogNumber. Examples: ""2008.1334"", ""145732a"", ""145732"""
http://rs.tdwg.org/dwc/terms/,http://rs.tdwg.org/dwc/terms/occurrenceRemarks,Occurrence Remarks,"Comments or notes about the Occurrence. see also http://rs.tdwg.org/dwc/terms/index.htm#occurrenceRemarks. Examples: ""found dead on road"""
http://rs.tdwg.org/dwc/terms/,http://rs.tdwg.org/dwc/terms/recordNumber,Record Number,"An identifier given to the Occurrence at the time it was recorded. Often serves as a link between field notes and an Occurrence record, such as a specimen collector's number. see also http://rs.tdwg.org/dwc/terms/index.htm#recordNumber. Examples: ""OPP 7101"""
http://rs.tdwg.org/dwc/terms/,http://rs.tdwg.org/dwc/terms/recordedBy,Recorded By,"A list (concatenated and separated) of names of people, groups, or organizations responsible for recording the original Occurrence. The primary collector or observer, especially one who applies a personal identifier (recordNumber), should be listed first. see also http://rs.tdwg.org/dwc/terms/index.htm#recordedBy. Examples: ""Oliver P. Pearson; Anita K. Pearson"" where the value in recordNumber ""OPP 7101"" corresponds to the number for the specimen in the field catalog (collector number) of Oliver P. Pearson."
http://rs.tdwg.org/dwc/terms/,http://rs.tdwg.org/dwc/terms/individualID,Individual ID,"An identifier for an individual or named group of individual organisms represented in the Occurrence. Meant to accommodate resampling of the same individual or group for monitoring purposes. May be a global unique identifier or an identifier specific to a data set. see also http://rs.tdwg.org/dwc/terms/index.htm#individualID. Examples: ""U.amer. 44"", ""Smedley"", ""Orca J 23"""
http://rs.tdwg.org/dwc/terms/,http://rs.tdwg.org/dwc/terms/individualCount,Individual Count,"The number of individuals represented present at the time of the Occurrence. see also http://rs.tdwg.org/dwc/terms/index.htm#individualCount. Examples: ""1"", ""25"""
http://rs.tdwg.org/dwc/terms/,http://rs.tdwg.org/dwc/terms/sex,Sex,"The sex of the biological individual(s) represented in the Occurrence. Recommended best practice is to use a controlled vocabulary. see also http://rs.tdwg.org/dwc/terms/index.htm#sex. Examples: ""female"", ""hermaphrodite"", ""male"""
http://rs.tdwg.org/dwc/terms/,http://rs.tdwg.org/dwc/terms/lifeStage,Life Stage,"The age class or life stage of the biological individual(s) at the time the Occurrence was recorded. Recommended best practice is to use a controlled vocabulary. see also http://rs.tdwg.org/dwc/terms/index.htm#lifeStage. Examples: ""egg"", ""eft"", ""juvenile"", ""adult"", ""2 adults 4 juveniles"""
http://rs.tdwg.org/dwc/terms/,http://rs.tdwg.org/dwc/terms/reproductiveCondition,Reproductive Condition,"The reproductive condition of the biological individual(s) represented in the Occurrence. Recommended best practice is to use a controlled vocabulary. see also http://rs.tdwg.org/dwc/terms/index.htm#reproductiveCondition. Examples: Examples"" ""non-reproductive"", ""pregnant"", ""in bloom"", ""fruit-bearing"""
http://rs.tdwg.org/dwc/terms/,http://rs.tdwg.org/dwc/terms/behavior,Behavior,"A description of the behavior shown by the subject at the time the Occurrence was recorded. Recommended best practice is to use a controlled vocabulary. see also http://rs.tdwg.org/dwc/terms/index.htm#behavior. Examples: ""roosting"", ""foraging"", ""running"""
http://rs.tdwg.org/dwc/terms/,http://rs.tdwg.org/dwc/terms/establishmentMeans,Establishment Means,"The process by which the biological individual(s) represented in the Occurrence became established at the location. Recommended best practice is to use a controlled vocabulary. see also http://rs.tdwg.org/dwc/terms/index.htm#establishmentMeans. Examples: ""cultivated"", ""invasive"", ""escaped from captivity"", ""wild"", ""native"""
http://rs.tdwg.org/dwc/terms/,http://rs.tdwg.org/dwc/terms/occurrenceStatus,Occurrence Status,"A statement about the presence or absence of a Taxon at a Location. Recommended best practice is to use a controlled vocabulary. see also http://rs.tdwg.org/dwc/terms/index.htm#occurrenceStatus. Examples: ""present"", ""absent"""
http://rs.tdwg.org/dwc/terms/,http://rs.tdwg.org/dwc/terms/preparations,Preparations,"A list (concatenated and separated) of preparations and preservation methods for a specimen. see also http://rs.tdwg.org/dwc/terms/index.htm#preparations. Examples: ""skin; skull; skeleton"", ""whole animal (ETOH); tissue (EDTA)"", ""fossil"", ""cast"", ""photograph"", ""DNA extract"""
http://rs.tdwg.org/dwc/terms/,http://rs.tdwg.org/dwc/terms/disposition,Disposition,"The current state of a specimen with respect to the collection identified in collectionCode or collectionID. Recommended best practice is to use a controlled vocabulary. see also http://rs.tdwg.org/dwc/terms/index.htm#disposition. Examples: ""in collection"", ""missing"", ""voucher elsewhere"", ""duplicates elsewhere"""
http://rs.tdwg.org/dwc/terms/,http://rs.tdwg.org/dwc/terms/otherCatalogNumbers,Other Catalog Numbers,"A list (concatenated and separated) of previous or alternate fully qualified catalog numbers or other human-used identifiers for the same Occurrence, whether in the current or any other data set or collection. see also http://rs.tdwg.org/dwc/terms/index.htm#otherCatalogNumbers. Examples: ""FMNH:Mammal:1234"", ""NPS YELLO6778; MBG 33424"""
http://rs.tdwg.org/dwc/terms/,http://rs.tdwg.org/dwc/terms/previousIdentifications,Previous Identifications,"A list (concatenated and separated) of previous assignments of names to the Occurrence. see also http://rs.tdwg.org/dwc/terms/index.htm#previousIdentifications. Examples: ""Anthus sp., field ID by G. Iglesias; Anthus correndera, expert ID by C. Cicero 2009-02-12 based on morphology"""
http://rs.tdwg.org/dwc/terms/,http://rs.tdwg.org/dwc/terms/associatedMedia,Associated Media,"A list (concatenated and separated) of identifiers (publication, global unique identifier, URI) of media associated with the Occurrence. see also http://rs.tdwg.org/dwc/terms/index.htm#associatedMedia. Examples: ""http://arctos.database.museum/SpecimenImages/UAMObs/Mamm/2/P7291179.JPG"""
http://rs.tdwg.org/dwc/terms/,http://rs.tdwg.org/dwc/terms/associatedReferences,Associated References,"A list (concatenated and separated) of identifiers (publication, bibliographic reference, global unique identifier, URI) of literature associated with the Occurrence. see also http://rs.tdwg.org/dwc/terms/index.htm#associatedReferences. Examples: ""http://www.sciencemag.org/cgi/content/abstract/322/5899/261"", ""Christopher J. Conroy, Jennifer L. Neuwald. 2008. Phylogeographic study of the California vole, Microtus californicus Journal of Mammalogy, 89(3):755-767."""
http://rs.tdwg.org/dwc/terms/,http://rs.tdwg.org/dwc/terms/associatedOccurrences,Associated Occurrences,"A list (concatenated and separated) of identifiers of other Occurrence records and their associations to this Occurrence. see also http://rs.tdwg.org/dwc/terms/index.htm#associatedOccurrences. Examples: ""sibling of FMNH:Mammal:1234; sibling of FMNH:Mammal:1235"""
http://rs.tdwg.org/dwc/terms/,http://rs.tdwg.org/dwc/terms/associatedSequences,Associated Sequences,"A list (concatenated and separated) of identifiers (publication, global unique identifier, URI) of genetic sequence information associated with the Occurrence. see also http://rs.tdwg.org/dwc/terms/index.htm#associatedSequences. Examples: ""GenBank: U34853.1"""
http://rs.tdwg.org/dwc/terms/,http://rs.tdwg.org/dwc/terms/associatedTaxa,Associated Taxa,"A list (concatenated and separated) of identifiers or names of taxa and their associations with the Occurrence. see also http://rs.tdwg.org/dwc/terms/index.htm#associatedTaxa. Examples: ""host: Quercus alba"""
http://rs.tdwg.org/dwc/terms/,http://rs.tdwg.org/dwc/terms/occurrenceDetails,Occurrence Details,"This term is deprecated in favor over the new dcterm:references. Previously this term was used as: A reference (publication, URI) to the most detailed information available about the Occurrence. see also http://rs.tdwg.org/dwc/terms/index.htm#occurrenceDetails"
http://purl.org/dc/terms/,http://purl.org/dc/terms/type,Type,"The nature or genre of the resource. For Darwin Core, recommended best practice is to use the name of the class that defines the root of the record. see also http://rs.tdwg.org/dwc/terms/index.htm#dcterms:type. Examples: ""StillImage"", ""MovingImage"", ""Sound"", ""PhysicalObject"", ""Event"""
http://purl.org/dc/terms/,http://purl.org/dc/terms/modified,Modified,"The most recent date-time on which the resource was changed. For Darwin Core, recommended best practice is to use an encoding scheme, such as ISO 8601:2004(E) see also http://rs.tdwg.org/dwc/terms/index.htm#dcterms:modified. Examples: ""1963-03-08T14:07-0600"" is 8 Mar 1963 2:07pm in the time zone six hours earlier than UTC, ""2009-02-20T08:40Z"" is 20 Feb 2009 8:40am UTC, ""1809-02-12"" is 12 Feb 1809, ""1906-06"" is Jun 1906, ""1971"" is just that year, ""2007-03-01T13:00:00Z/2008-05-11T15:30:00Z"" is the interval between 1 Mar 2007 1pm UTC and 11 May 2008 3:30pm UTC, ""2007-11-13/15"" is the interval between 13 Nov 2007 and 15 Nov 2007"
http://purl.org/dc/terms/,http://purl.org/dc/terms/language,Language,"A language of the resource. Recommended best practice is to use a controlled vocabulary such as RFC 4646 [RFC4646] see also http://rs.tdwg.org/dwc/terms/index.htm#dcterms:language. Examples: ""en"" for English, ""es"" for Spanish"
http://purl.org/dc/terms/,http://purl.org/dc/terms/rights,Rights,"Information about rights held in and over the resource. Typically, rights information includes a statement about various property rights associated with the resource, including intellectual property rights see also http://rs.tdwg.org/dwc/terms/index.htm#dcterms:rights. Examples: ""Content licensed under Creative Commons Attribution 3.0 United States License"""
http://purl.org/dc/terms/,http://purl.org/dc/terms/rightsHolder,Rights Holder,"A person or organization owning or managing rights over the resource see also http://rs.tdwg.org/dwc/terms/index.htm#dcterms:rightsHolder. Examples: ""The Regents of the University of California."""
http://purl.org/dc/terms/,http://purl.org/dc/terms/accessRights,Access Rights,"Information about who can access the resource or an indication of its security status. Access Rights may include information regarding access or restrictions based on privacy, security, or other policies see also http://rs.tdwg.org/dwc/terms/index.htm#dcterms:accessRights. Examples: ""not-for-profit use only"""
http://purl.org/dc/terms/,http://purl.org/dc/terms/bibliographicCitation,Bibliographic Citation,"A bibliographic reference for the resource as a statement indicating how this record should be cited (attributed) when used. Recommended practice is to include sufficient bibliographic detail to identify the resource as unambiguously as possible see also http://rs.tdwg.org/dwc/terms/index.htm#dcterms:bibliographicCitation. Examples: ""Ctenomys sociabilis (MVZ 165861)"" for a specimen, ""Oliver P. Pearson. 1985. Los tuco-tucos (genera Ctenomys) de los Parques Nacionales Lanin y Nahuel Huapi, Argentina Historia Natural, 5(37):337-343."" for a Taxon"
http://purl.org/dc/terms/,http://purl.org/dc/terms/references,References,"A URL to a related resource that is referenced, cited, or otherwise pointed to by the described resource. Often another webpage showing the same, but richer resource see also http://rs.tdwg.org/dwc/terms/index.htm#dcterms:references. Examples: http://www.itis.gov/servlet/SingleRpt/SingleRpt?search_topic=TSN&search_value=552479"
http://rs.tdwg.org/dwc/terms/,http://rs.tdwg.org/dwc/terms/institutionID,Institution ID,An identifier for the institution having custody of the object(s) or information referred to in the record. see also http://rs.tdwg.org/dwc/terms/index.htm#institutionID
http://rs.tdwg.org/dwc/terms/,http://rs.tdwg.org/dwc/terms/collectionID,Collection ID,"An identifier for the collection or dataset from which the record was derived. For physical specimens, the recommended best practice is to use the identifier in a collections registry such as the Biodiversity Collections Index (http://www.biodiversitycollectionsindex.org/). see also http://rs.tdwg.org/dwc/terms/index.htm#collectionID. Examples: ""urn:lsid:biocol.org:col:34818"""
http://rs.tdwg.org/dwc/terms/,http://rs.tdwg.org/dwc/terms/datasetID,Dataset ID,An identifier for the set of data. May be a global unique identifier or an identifier specific to a collection or institution. see also http://rs.tdwg.org/dwc/terms/index.htm#datasetID
http://rs.tdwg.org/dwc/terms/,http://rs.tdwg.org/dwc/terms/institutionCode,Institution Code,"The name (or acronym) in use by the institution having custody of the object(s) or information referred to in the record. see also http://rs.tdwg.org/dwc/terms/index.htm#institutionCode. Examples: ""MVZ"", ""FMNH"", ""AKN-CLO"", ""University of California Museum of Paleontology (UCMP)"""
http://rs.tdwg.org/dwc/terms/,http://rs.tdwg.org/dwc/terms/collectionCode,Collection Code,"The name, acronym, coden, or initialism identifying the collection or data set from which the record was derived. see also http://rs.tdwg.org/dwc/terms/index.htm#collectionCode. Examples: ""Mammals"", ""Hildebrandt"", ""eBird"""
